index,published,keyword,domain,language,valid,title,description,url,image,archive,content,quote,de,en,la,added
aab44e3435d995ab953904f6e568f59c,2025-12-03T02:30:07Z,'Wassermanagement',www.stern.de,de,0.9,Landtag: Landtag mit vorletzter Plenarsitzung in diesem Jahr,"Wassermanagement, Bürokratie, Mietwucher: Auf der vorletzten Sitzung des Sächsischen Landtages in diesem Jahr stehen noch einmal brisante Themen auf dem Programm.",https://www.stern.de/gesellschaft/regional/sachsen/landtag--landtag-mit-vorletzter-plenarsitzung-in-diesem-jahr-36921818.html,https://image.stern.de/36921820/t/pP/v1/w1440/r1.7778/-/03--4jkqsrvgybv1axs2048jpeg---3fa0bfb871418c09.jpg,,"Kopiere den aktuellen Link
Zur Merkliste hinzufügen
Wassermanagement, Bürokratie, Mietwucher: Auf der vorletzten Sitzung des Sächsischen Landtages in diesem Jahr stehen noch einmal brisante Themen … [+1664 chars]",,"Landtag: Landtag mit vorletzter Plenarsitzung in diesem Jahr. Wassermanagement, Bürokratie, Mietwucher: Auf der vorletzten Sitzung des Sächsischen Landtages in diesem Jahr stehen noch einmal brisante Themen auf dem Programm.","State Parliament: State Parliament with its penultimate plenary session this year. Water management, bureaucracy, rent extortion: At the penultimate session of the Saxon state parliament this year, explosive topics are once again on the agenda.","Parlamentum rei publicae: parlamentum rei publicae cum suo penultima sessione plenaria hoc anno. Aquarum procuratio, burocratica, redditio repetundarum: In paenultima sessione parlamenti status Saxonis hoc anno, argumenta explosiva iterum in agendis sunt.",2025-12-04 03:09:41+00:00
2c401763238e5c8a403892410a4ab165,2025-12-07T10:09:03Z,'Wasserknappheit',www.stern.de,de,0.9,Trinkwasserversorgung: Wasserknappheit: Liefert Schmalwasser bald doch Trinkwasser?,"Trockenheit wegen geringer Niederschläge hat in diesem Jahr dazu geführt, dass eine wichtige Trinkwassertalsperre zu wenig gefüllt war. Nun gibt es neue Überlegungen zur Schmalwassertalsperre.",https://www.stern.de/gesellschaft/regional/thueringen/trinkwasserversorgung--wasserknappheit--liefert-schmalwasser-bald-doch-trinkwasser--36936764.html,https://image.stern.de/36936766/t/cw/v1/w1440/r1.7778/-/07--2e5uzjhvs3v15axs2048jpeg---91c7fb49c7fabf1e.jpg,,"Kopiere den aktuellen Link
Zur Merkliste hinzufügen
Trockenheit wegen geringer Niederschläge hat in diesem Jahr dazu geführt, dass eine wichtige Trinkwassertalsperre zu wenig gefüllt war. Nun gibt … [+3514 chars]",,"Trinkwasserversorgung: Wasserknappheit: Liefert Schmalwasser bald doch Trinkwasser?. Trockenheit wegen geringer Niederschläge hat in diesem Jahr dazu geführt, dass eine wichtige Trinkwassertalsperre zu wenig gefüllt war. Nun gibt es neue Überlegungen zur Schmalwassertalsperre.","Drinking water supply: Water shortage: Will Schmalwasser soon provide drinking water? This year, drought due to low rainfall meant that an important drinking water dam was underfilled. Now there are new considerations for the narrow water dam.","Aquarum bibens copiam: Aquae penuriam: Num Schmalwasser aquam bibentem mox praebebit? Hoc anno, siccitas propter gravem pluviam significabat magnam aquam matricem bibendi implevisse. Nunc novae considerationes pro angusto aquae matre.",2025-12-09 13:22:14+00:00
6c67d5d263f21db02ff151fb2349bfce,2025-12-05T09:28:37Z,'Risikomanagement',orf.at,de,0.9,RH: Mängel bei Risikomanagement von OeNB,,https://orf.at/stories/3413543/,https://orf.at/mojo/1_4_1/storyserver//news/common/images/og-fallback-news.png,,Die Österreichische Nationalbank (OeNB) soll ihr Veranlagungs- und Risikomanagementkonzept grundlegend überarbeiten. Das fordert der Rechnungshof (RH) in einem heute veröffentlichten Bericht. Die OeN… [+1527 chars],,RH: Mängel bei Risikomanagement von OeNB. None,RH: Deficiencies in OeNB’s risk management. None,RH: Defectus in administratione periculi OeNB. Nullus,2025-12-10 13:23:10+00:00
e69cbb72e6c35c1846969e6f2fe493ac,2025-12-05T10:06:03Z,'Risikomanagement',www.diepresse.com,de,0.9,Rechnungshof sieht Mängel bei Risikomanagement der OeNB,Dem aktuellen Bericht des Rechnungshofs zufolge teilen die Prüfer das Verlangen von Nationalratsabgeordneten: Das Veranlagungskonzept der Nationalbank solle „grundlegend“ überarbeitet werden.,https://www.diepresse.com/20379102/rechnungshof-sieht-maengel-bei-risikomanagement-der-oenb,https://img.diepresse.com/public/incoming/huuls1-%C3%B6sterreichische-Nationalbank/alternates/DPR_SOCIAL_NACHRICHTEN/%C3%B6sterreichische%20Nationalbank,,"Dem aktuellen Bericht des Rechnungshofs zufolge teilen die Prüfer das Verlangen von Nationalratsabgeordneten: Das Veranlagungskonzept der Nationalbank solle grundlegend überarbeitet werden. 
Die Öst… [+1985 chars]",,Rechnungshof sieht Mängel bei Risikomanagement der OeNB. Dem aktuellen Bericht des Rechnungshofs zufolge teilen die Prüfer das Verlangen von Nationalratsabgeordneten: Das Veranlagungskonzept der Nationalbank solle „grundlegend“ überarbeitet werden.,"Court of Auditors sees deficiencies in the OeNB's risk management. According to the current report from the Court of Auditors, the auditors share the request of members of the National Council: the National Bank's investment concept should be “fundamentally” revised.","Curia Auditorum defectiones in periculo OeNB administratione videt. Secundum hodiernam relationem e Curia Auditorum, Auditores rogationem membrorum Consilii Nationalis communicant: notio collocationis Nationalis Bank ""fundamentaliter"" recognoscenda debet.",2025-12-10 13:23:10+00:00
80b1edc3590cf5dfa11df5783dbb94a4,2025-12-08T06:32:01Z,'Risikomanagement',www.computerweekly.com,de,0.9,NIS2 ist in Kraft: Was Unternehmen beachten müssen | Computer Weekly,"Ab dem 6. Dezember 2025 ist das Gesetz zur Umsetzung von NIS2 in Kraft. Damit gelten für viele Unternehmen neue Vorgaben in Sachen Cybersicherheit, Risikomanagement und Resilienz.",https://www.computerweekly.com/de/feature/NIS2-ist-in-Kraft-Was-Unternehmen-beachten-muessen,https://www.computerweekly.com/visuals/German/Hero-Data-Sovereignty-Khfd-04.jpg,,Am 5. Dezember 2025 wurde das Gesetz zur Umsetzung der NIS-2-Richtlinie und zur Regelung wesentlicher Grundzüge des Informationssicherheitsmanagements in der Bundesverwaltungverkündet. Damit ist es s… [+6366 chars],,"NIS2 ist in Kraft: Was Unternehmen beachten müssen | Computer Weekly. Ab dem 6. Dezember 2025 ist das Gesetz zur Umsetzung von NIS2 in Kraft. Damit gelten für viele Unternehmen neue Vorgaben in Sachen Cybersicherheit, Risikomanagement und Resilienz.","NIS2 is in force: What companies need to consider | Computer Weekly. From December 6, 2025, the law implementing NIS2 will be in force. This means that many companies are subject to new requirements in terms of cybersecurity, risk management and resilience.","NIS2 viget: Quae turmae considerare debent | Computatrum Weekly. Ex die 6 Decembris 2025 lex exsecutiva NIS2 vigebit. Hoc significat multas societates novis postulationibus obnoxias esse in terminis cybersecurity, periculorum administratio et mollitiae.",2025-12-10 13:23:10+00:00
