index,url,valid,domain,title,description,image,published,archive,content,quote,language,keyword
https://www.stern.de/panorama/wissen/klimawandel--wenig-schnee--viel-hitze--gletscher-schrumpfen-weiter-36096194.html,https://www.stern.de/panorama/wissen/klimawandel--wenig-schnee--viel-hitze--gletscher-schrumpfen-weiter-36096194.html,0,www.stern.de,"Klimawandel: Wenig Schnee, viel Hitze: Gletscher schrumpfen weiter",Gletscherschwund im Rekordtempo: Warum ein schneearmer Winter und Hitzewellen das Schweizer Gebirge gefährlicher machen – und was das für Alpendörfer wie Blatten bedeutet.,https://image.stern.de/36096196/t/7i/v1/w1440/r1.7778/-/01--ltv75aqgwuv3axs2048jpeg---6fc7ab2906a8b0e0.jpg,2025-10-01T07:00:08Z,,"Kopiere den aktuellen Link
Zur Merkliste hinzufügen
Gletscherschwund im Rekordtempo: Warum ein schneearmer Winter und Hitzewellen das Schweizer Gebirge gefährlicher machen und was das für Alpendörf… [+2406 chars]",,de,'Hitzewelle'
https://www.focus.de/wissen/die-weissen-riesen-zerfallen-experten-warnen-vor-dramatischem-gletscher-sterben_b29a8723-ef5d-4259-ab8d-0fbb9a9b7e18.html,https://www.focus.de/wissen/die-weissen-riesen-zerfallen-experten-warnen-vor-dramatischem-gletscher-sterben_b29a8723-ef5d-4259-ab8d-0fbb9a9b7e18.html,0,www.focus.de,Die weißen Riesen zerfallen: Experten warnen vor dramatischem Gletscher-Sterben,Gletscherschwund im Rekordtempo: Warum ein schneearmer Winter und Hitzewellen das Schweizer Gebirge gefährlicher machen – und was das für Alpendörfer wie Blatten bedeutet.,https://quadro.burda-forward.de/ctf/635a8850-7385-4e6b-837c-b129bfd2e04d.2f7ad36e-1965-4e7e-86de-7ebec6a92038.jpeg?im=RegionOfInterestCrop%3D%281200%2C630%29%2CregionOfInterest%3D%28993%2C757%29&hash=440fddd9a8091696f58fce5664e896c255c168a36659d71815b8185026d6aa2c,2025-10-01T08:02:38Z,,"Es gibt keine Verschnaufpause für die Schweizer Gletscher: in diesem Jahr wurde bei ihnen der viertgrößte Schwund seit Messbeginn 1950 erfasst. Ihr Volumen ging um drei Prozent zurück, wie das Gletsc… [+4175 chars]",,de,'Hitzewelle'
https://www.stern.de/panorama/wetter/extremwetter-in-deutschland--kurze-geschichte-in-grafiken-36067056.html,https://www.stern.de/panorama/wetter/extremwetter-in-deutschland--kurze-geschichte-in-grafiken-36067056.html,0,www.stern.de,"Hitze, Dürren, Starkregen: Eine kurze Geschichte des Extremwetters in Deutschland",Deutschland erhitzt sich doppelt so schnell wie der Rest der Welt. Woran liegt das? Und was bedeutet das für uns? Ein Blick auf über 100 Jahre deutsche Wettergeschichte.,https://image.stern.de/36079846/t/QD/v7/w1440/r1.7778/-/extremwetter-6.jpg,2025-10-03T17:39:00Z,,"Kopiere den aktuellen Link
Zur Merkliste hinzufügen
Deutschland erhitzt sich doppelt so schnell wie der Rest der Welt. Woran liegt das? Und was bedeutet das für uns? Ein Blick auf über 100 Jahre de… [+12786 chars]",,de,'Hitzewelle'
