index,published,keyword,domain,language,valid,title,description,url,image,archive,content,quote,de,en,la,added
aab44e3435d995ab953904f6e568f59c,2025-12-03T02:30:07Z,'Wassermanagement',www.stern.de,de,0.9,Landtag: Landtag mit vorletzter Plenarsitzung in diesem Jahr,"Wassermanagement, Bürokratie, Mietwucher: Auf der vorletzten Sitzung des Sächsischen Landtages in diesem Jahr stehen noch einmal brisante Themen auf dem Programm.",https://www.stern.de/gesellschaft/regional/sachsen/landtag--landtag-mit-vorletzter-plenarsitzung-in-diesem-jahr-36921818.html,https://image.stern.de/36921820/t/pP/v1/w1440/r1.7778/-/03--4jkqsrvgybv1axs2048jpeg---3fa0bfb871418c09.jpg,,"Kopiere den aktuellen Link
Zur Merkliste hinzufügen
Wassermanagement, Bürokratie, Mietwucher: Auf der vorletzten Sitzung des Sächsischen Landtages in diesem Jahr stehen noch einmal brisante Themen … [+1664 chars]",,"Landtag: Landtag mit vorletzter Plenarsitzung in diesem Jahr. Wassermanagement, Bürokratie, Mietwucher: Auf der vorletzten Sitzung des Sächsischen Landtages in diesem Jahr stehen noch einmal brisante Themen auf dem Programm.","State Parliament: State Parliament with its penultimate plenary session this year. Water management, bureaucracy, rent extortion: At the penultimate session of the Saxon state parliament this year, explosive topics are once again on the agenda.","Parlamentum rei publicae: parlamentum rei publicae cum suo penultima sessione plenaria hoc anno. Aquarum procuratio, burocratica, redditio repetundarum: In paenultima sessione parlamenti status Saxonis hoc anno, argumenta explosiva iterum in agendis sunt.",2025-12-04 03:09:41+00:00
2c401763238e5c8a403892410a4ab165,2025-12-07T10:09:03Z,'Wasserknappheit',www.stern.de,de,0.9,Trinkwasserversorgung: Wasserknappheit: Liefert Schmalwasser bald doch Trinkwasser?,"Trockenheit wegen geringer Niederschläge hat in diesem Jahr dazu geführt, dass eine wichtige Trinkwassertalsperre zu wenig gefüllt war. Nun gibt es neue Überlegungen zur Schmalwassertalsperre.",https://www.stern.de/gesellschaft/regional/thueringen/trinkwasserversorgung--wasserknappheit--liefert-schmalwasser-bald-doch-trinkwasser--36936764.html,https://image.stern.de/36936766/t/cw/v1/w1440/r1.7778/-/07--2e5uzjhvs3v15axs2048jpeg---91c7fb49c7fabf1e.jpg,,"Kopiere den aktuellen Link
Zur Merkliste hinzufügen
Trockenheit wegen geringer Niederschläge hat in diesem Jahr dazu geführt, dass eine wichtige Trinkwassertalsperre zu wenig gefüllt war. Nun gibt … [+3514 chars]",,"Trinkwasserversorgung: Wasserknappheit: Liefert Schmalwasser bald doch Trinkwasser?. Trockenheit wegen geringer Niederschläge hat in diesem Jahr dazu geführt, dass eine wichtige Trinkwassertalsperre zu wenig gefüllt war. Nun gibt es neue Überlegungen zur Schmalwassertalsperre.","Drinking water supply: Water shortage: Will Schmalwasser soon provide drinking water? This year, drought due to low rainfall meant that an important drinking water dam was underfilled. Now there are new considerations for the narrow water dam.","Aquarum bibens copiam: Aquae penuriam: Num Schmalwasser aquam bibentem mox praebebit? Hoc anno, siccitas propter gravem pluviam significabat magnam aquam matricem bibendi implevisse. Nunc novae considerationes pro angusto aquae matre.",2025-12-09 13:22:14+00:00
